label,sublabel,description,styles,bgcolor
可燃ごみ,,市指定の可燃ごみ袋で口をしっかりしばって出してください,img/moyasu02.svg,#ea3b13
プラスチック類ごみ,,市指定のプラスチック類ごみ袋で口をしっかりしばって出してください,img/moyasanai02.svg,#685ecf
不燃ゴミ,,市指定の不燃物ごみ袋で口をしっかりしばって出してください,img/moyasanai02.svg,#733b96
粗大ごみ,,清掃券を貼って指定日朝7時30分までに指定集積場に出してください。縦・横・奥行きの長さが３辺とも全て１．５mを超えるものについては収集できません,img/moyasu02.svg,#ff9f37
空き缶,,スプレー缶は使い切って穴をあけ黄色のコンテナへ。空缶は青色のコンテナへ,img/shigen02.svg,#81d12e
蛍光管,,割れた蛍光管、LED製品、白熱電球は不燃ごみ。外箱は紙類の日に,img/shigen02.svg,#27a047
空きビン,,空ビン類はキャップ等を取り、洗って集積場の青色のコンテナへ,img/shigen02.svg,#2dc7aa
紙・布類,,牛乳パックは開いて、洗って、乾かしてだしてください。雑がみは、紙袋に入れてください。衣類は中の見える袋で出してください。（黒ビニール袋では出せません。）,img/shigen02.svg,#bbe400
